[
  {
    "executive_summary": [
      "The spec establishes the intended split between synthesizable core and simulation-only BFM, but several requirements depend on undefined external timing parameters and undefined CDC mechanisms, which prevents safe implementation from the text alone.",
      "Frame-start semantics are internally inconsistent: some text says a frame begins on cs_n assertion, while stricter text says it begins only at a qualified first sclk rising edge after legal timing checks.",
      "The receive CDC path is specified in enough detail to imply intentional data loss under rate mismatch, but the exact coherency requirements for the transferred byte versus toggle event are not fully defined, creating a real risk of byte/event mismatch.",
      "The transmit CDC path is underspecified and partially contradictory: the spec forbids direct sampling, requires a coherent capture event, but provides no interface, handshake, latency bound, or overwrite policy for preload updates.",
      "Several timing-critical behaviors are left unspecified or delegated to integration constraints, especially T_CSS_MIN, cs_n/sclk setup-hold exclusion handling, and minimum cs_n high time between frames.",
      "Verification guidance is incomplete for the highest-risk areas: CDC correctness, illegal start rejection boundaries, asynchronous cs_n behavior around sclk edges, and MISO output-enable glitch behavior are not covered rigorously enough.",
      "As written, the spec is directionally useful but needs major revision before implementation because multiple compliant interpretations remain possible in core frame qualification, CDC, and external timing assumptions."
    ],
    "solid_points": [
      "The spec clearly separates synthesizable core behavior from simulation-only BFM behavior and explicitly forbids simulation-only constructs inside the core RTL.",
      "SPI mode, frame width, and bit ordering are consistently defined as Mode 0, fixed 8-bit, MSB-first across most sections.",
      "The MISO tri-state ownership model is well defined: the core exposes miso_o and miso_oe only, with actual pad tri-state delegated to an external wrapper.",
      "Abort behavior for cs_n deassertion before 8 qualified rising edges is consistently specified to suppress completion and rx_valid.",
      "The spec explicitly states that extra sclk activity after normal 8-bit completion while cs_n remains low shall be ignored until cs_n returns high."
    ],
    "issues": [
      {
        "id": "ISS-001",
        "severity": "critical",
        "topic": "frame_start_definition",
        "problem": "The spec uses conflicting frame-start definitions. Examples: \"A frame begins when cs_n is observed low after previously being high and the synthesizable layer enters frame-active state\" versus \"frame-start recognition shall occur only in the sclk domain\" and \"A legal frame start is recognized at a candidate first rising edge of sclk only if cs_n has been continuously low for at least T_CSS_MIN before that edge\".",
        "why_it_matters": "These are different state models. One interpretation activates a frame on cs_n falling; another activates only on the first qualified sclk rising edge. Implementations will differ in when miso_oe asserts, when tx byte selection occurs, when bit_count starts, and how illegal starts are rejected. Verification can pass one interpretation and fail another.",
        "recommended_fix": "Define a single normative event: either (A) frame_active asserts on cs_n falling after confirming sclk=0 and waits for first qualified rising edge, or (B) frame_active asserts only on the first qualified rising edge. Then align all behavioral, state-machine, and assertion text to that same event. Recommended: define a separate state `frame_pending` on legal cs_n fall and `frame_active` on first qualified rising edge."
      },
      {
        "id": "ISS-002",
        "severity": "critical",
        "topic": "external_timing_parameter",
        "problem": "T_CSS_MIN is required for legal frame qualification, but no numeric value, units, derivation rule, or ownership is defined. The spec repeatedly references \"T_CSS_MIN\" and \"tCSS(min)\" without actually specifying it.",
        "why_it_matters": "Without a defined requirement, legal versus illegal frame start is unverifiable and unimplementable as a reusable core requirement. In hardware, the core cannot measure an analog package-pin interval unless tied to a specific clocking method. Different readers may treat this as a board timing constraint, a simulation parameter, or a digital counter-based check.",
        "recommended_fix": "State explicitly that T_CSS_MIN is either (1) an external timing assumption not checked by the core and enforced only by integration/verification, or (2) a digital check implemented in the sclk domain using a specified timebase. For this core, recommended wording: the core does not measure T_CSS_MIN internally; legal operation requires external timing to satisfy `cs_n low setup to first sclk rising edge >= T_CSS_MIN`, where T_CSS_MIN is a board/interface requirement documented by the integrating system."
      },
      {
        "id": "ISS-003",
        "severity": "major",
        "topic": "illegal_start_behavior",
        "problem": "Illegal frame-start behavior is inconsistent. One part says illegal transfers are ignored until cs_n returns high; another verification assertion says \"If the cs_n-low-to-first-sclk-rise timing requirement is violated, first-bit transmit behavior is unspecified.\"",
        "why_it_matters": "\"Ignored until cs_n returns high\" and \"first-bit transmit behavior is unspecified\" are not equivalent. One requires deterministic suppression of activity; the other permits arbitrary behavior on first-bit transmit. This can cause mismatched RTL/testbench behavior and mask real bugs.",
        "recommended_fix": "Pick one rule. Recommended: for any illegal start, no frame is recognized, bit_count remains zero, rx_valid remains zero, no rx completion occurs, and miso_oe may remain deasserted or deassert immediately; all sclk edges are ignored until cs_n returns high. Remove any statement that first-bit behavior is unspecified for illegal starts."
      },
      {
        "id": "ISS-004",
        "severity": "critical",
        "topic": "tx_cdc_mechanism",
        "problem": "The transmit CDC requirement mandates a \"defined coherent CDC scheme\" and a \"synchronized capture event\" into tx_shadow_data/tx_shadow_valid, but no actual interface, handshake, acknowledgment, overwrite rule, or latency guarantee is defined.",
        "why_it_matters": "This is the core correctness risk for MISO data selection. Without a defined CDC protocol, tx_shadow_data and tx_shadow_valid can become incoherent, stale, or overwritten near frame start. Implementers may choose incompatible schemes: double-sampled bus, toggle handshake, pulse-stretch valid, or asynchronous hold-and-sample. Some are unsafe for multi-bit coherence.",
        "recommended_fix": "Specify the CDC protocol normatively. Example: clk domain presents `tx_data` and raises `tx_valid`; a `tx_update_tgl_clk` toggles only when tx_valid and tx_data are stable; sclk domain synchronizes the toggle, captures the byte and valid atomically into `tx_shadow_*`, and optionally returns `tx_update_ack_tgl_sclk`. Also define whether repeated updates may overwrite an unseen preload and whether `tx_shadow_valid` clears on tx_valid deassertion only after synchronized observation."
      },
      {
        "id": "ISS-005",
        "severity": "critical",
        "topic": "rx_cdc_coherency",
        "problem": "The receive CDC path says the clk domain shall synchronize `rx_event_tgl_sclk`, detect a toggle, and capture the corresponding stable receive byte into a single clk-domain holding register, but it does not define the coherency method for the multi-bit `rx_hold_sclk` crossing.",
        "why_it_matters": "A toggle synchronizer only safely transfers the event, not the 8-bit data bus. If `rx_hold_sclk` is sampled directly in clk domain without a stability guarantee window tied to the event, the clk domain can capture a mixed or metastable byte. This is a classic CDC failure mode.",
        "recommended_fix": "Define the coherency rule explicitly. Recommended: `rx_hold_sclk` shall be written only on frame completion and remain unchanged until the next completion event; clk domain shall sample `rx_hold_sclk` only after synchronized detection of `rx_event_tgl_sclk`, with the spec explicitly relying on the hold register remaining stable until the next event. If that assumption is not acceptable, require a proper handshake or asynchronous FIFO."
      },
      {
        "id": "ISS-006",
        "severity": "major",
        "topic": "lossy_receive_semantics",
        "problem": "The spec permits lossy receive behavior if a later completion occurs before a prior toggle is observed, but the loss model is ambiguous. It variously says the older pending completion may be lost and later says the later byte may overwrite the earlier byte and the earlier pending event may be lost.",
        "why_it_matters": "There are at least two different failure models: lose older event but keep latest data, or lose newer event because toggle collapses, or byte/event mismatch. Verification expectations differ substantially. Integrators need to know whether the interface is latest-wins, first-wins, or undefined under overrun.",
        "recommended_fix": "Define one explicit overrun policy. Recommended: latest-completion-wins. State that each new frame completion overwrites `rx_hold_sclk`; if multiple completions occur before clk observes a toggle, only the most recent completed byte is guaranteed to be reported, and exactly one rx_valid pulse may result for the most recent byte."
      },
      {
        "id": "ISS-007",
        "severity": "major",
        "topic": "miso_oe_timing",